<?xml version="1.0" encoding="UTF-8"?>
<!DOCTYPE dcm4chee-attribute-filter SYSTEM "dcm4chee-attribute-filter.dtd">
<dcm4chee-attribute-filter>
    <soundex class="org.dcm4che2.soundex.Soundex" trailing-wildcard="false"/>
    <!--
    <soundex class="org.dcm4che2.soundex.ESoundex"/>
    <soundex class="org.dcm4che2.soundex.ESoundex2"/>
    <soundex class="org.dcm4che2.soundex.KPhonetik"/>
    <soundex class="org.dcm4che2.soundex.Metaphone"/>
    <soundex class="org.dcm4che2.soundex.Phonem"/>
    -->
    <patient>
        <attr tag="00080005"/> <!-- Specific Character Set -->
        <attr tag="00100010" case-sensitive="false"/> <!--  Patient's Name -->
        <attr tag="00100020"/> <!--  Patient ID -->
    </patient>
    <exclude-patient exclude="true" tsuid="1.2.840.10008.1.2.1.99">
        <attr tag="00081120"/> <!-- Referenced Patient Sequence -->
        <attr tag="00100010"/> <!--  Patient's Name -->
        <attr tag="00100020"/> <!--  Patient ID -->
    </exclude-patient>
    <study>
        <attr tag="00080005"/> <!-- Specific Character Set -->
        <attr tag="00080020"/> <!-- Study Date -->
        <attr tag="00080030"/> <!-- Study Time -->
        <attr tag="00080050"/> <!-- Accession Number -->
        <attr tag="0020000D" coerce="false"/> <!-- Study Instance UID -->
        <attr tag="00200010"/> <!-- Study ID -->
    </study>
    <series>
        <attr tag="00080060"/> <!-- Modality -->
        <attr tag="0020000E" coerce="false"/> <!-- Series Instance UID -->
        <attr tag="00200011"/> <!-- Series Number -->
    </series>
    <instance>
        <attr tag="00080016"/> <!-- SOP Class UID -->
        <attr tag="00080018"/> <!-- SOP Instance UID -->
        <attr tag="00200013"/> <!-- Instance Number -->
    </instance>
</dcm4chee-attribute-filter>
